{
  "$schema": "http://json-schema.org/draft-07/schema#",
  "$id": "https://web3sec.local/schema/evaluation_case.schema.json",
  "title": "WebSec Evaluation Case",
  "description": "One labeled case the framework measures itself against, distilled from a public dataset (or a manual entry). Cases belong to the FRAMEWORK, not to one campaign: the repo-level eval store (src/webv2/eval_store.py) keeps them in eval/cases.json with a sha256 sidecar, so a hand edit is detectable drift. Provenance is mandatory (sprint constraint 5): the source dataset + record id (+ url when the source has one), the ingestion stamp (created_at, stamped by add_case), the operator-supplied on-chain/advisory date (deployed_at, optional — never stamped or defaulted by the framework), and schema_version. The leakage partition (sprint constraint 4) states which evaluation split the case belongs to; 'held-out'/'training' cases are eval-only data and never surface as proposer context or promotable memory.",
  "type": "object",
  "additionalProperties": false,
  "required": [
    "case_id",
    "source",
    "partition",
    "program",
    "gold",
    "code",
    "created_at",
    "schema_version"
  ],
  "properties": {
    "case_id": {
      "type": "string",
      "pattern": "^CASE-[a-f0-9]{12}$"
    },

    "source": {
      "type": "object",
      "additionalProperties": false,
      "required": ["dataset", "record_id"],
      "properties": {
        "dataset": {
          "enum": [
            "scabench",
            "defihacklabs",
            "defihacklabs-explorer",
            "forge",
            "forge-curated",
            "c4audit",
            "sherlock",
            "immunefi-resolved",
            "smartbugs-curated",
            "manual"
          ],
          "description": "which public dataset (or manual entry) the case was distilled from"
        },
        "record_id": {
          "type": "string",
          "minLength": 1,
          "description": "the record's id WITHIN the source dataset, verbatim (commit hash, incident slug, case number, ...) — the only bridge back to the raw record"
        },
        "url": {
          "type": "string",
          "minLength": 1,
          "description": "the source record's public URL, when the dataset has one"
        }
      }
    },

    "partition": {
      "enum": ["dev", "held-out", "training"],
      "default": "dev",
      "description": "leakage partition (sprint constraint 4): 'dev' behaves like today's shared rows; 'held-out' and 'training' are evaluation data that must NEVER surface in proposer-context negative-memory injection and must NEVER be promotable. add_case stamps 'dev' when the caller omits it."
    },

    "program": {
      "type": "object",
      "additionalProperties": false,
      "required": ["program"],
      "properties": {
        "program": {
          "type": "string",
          "minLength": 1,
          "description": "the audited program's name — same field the bounty policy carries, so program-key derivation (shared_memory._program_key) can key eval metrics by program"
        },
        "platform": {
          "type": ["string", "null"],
          "description": "bounty platform, when known (e.g. immunefi, cantina, sherlock)"
        },
        "chains": {
          "type": "array",
          "items": { "type": "string" },
          "description": "chains the program's contracts live on"
        }
      }
    },

    "gold": {
      "type": "object",
      "additionalProperties": false,
      "required": ["outcome", "bug_class", "root_cause"],
      "properties": {
        "outcome": {
          "enum": [
            "confirmed-exploitable",
            "confirmed-not-exploitable",
            "disproved",
            "out-of-scope",
            "duplicate",
            "economic-no-go"
          ],
          "description": "the adjudicated ground truth for this case"
        },
        "bug_class": {
          "type": "string",
          "pattern": "^[a-z0-9-]{3,64}$",
          "description": "a canonical taxonomy class OR the literal 'unmapped' — never a raw dataset label; the taxonomy map layer (webv2.taxonomy.normalize_class) resolves those"
        },
        "bug_class_accept": {
          "type": "array",
          "items": {
            "type": "string",
            "pattern": "^[a-z0-9-]{3,64}$"
          },
          "description": "alternative canonical classes the eval spec ALSO accepts for this case's mechanism (the same vocabulary and pattern as bug_class): an auditor who filed the bug under one of these is not wrong, so the join anchors them too. Absent means 'the single bug_class only', exactly as before this key existed. This is the eval spec's accept list, not a weakening of the anchor — the location suffix rule is unchanged."
        },
        "severity": {
          "enum": ["high", "medium", "low", "informational", "none", null],
          "description": "the dataset's severity label, when it states one"
        },
        "root_cause": {
          "type": "string",
          "minLength": 10,
          "maxLength": 2000,
          "description": "one-paragraph root cause in the dataset's own words, enough to adjudicate a hypothesis against"
        },
        "locations": {
          "type": "array",
          "description": "where the bug lives, when the dataset points at code",
          "items": {
            "type": "object",
            "additionalProperties": false,
            "required": ["file"],
            "properties": {
              "file": { "type": "string", "minLength": 1 },
              "line": { "type": "integer", "minimum": 1 }
            }
          }
        }
      }
    },

    "code": {
      "type": "object",
      "additionalProperties": false,
      "required": ["repo"],
      "properties": {
        "repo": {
          "type": "string",
          "minLength": 1,
          "description": "the affected code repository (url or owner/name)"
        },
        "commit": {
          "type": "string",
          "pattern": "^[0-9a-f]{7,64}$",
          "description": "the exact commit the gold label was adjudicated against, when known"
        },
        "files": {
          "type": "array",
          "items": { "type": "string" },
          "description": "repo-relative paths of the affected files"
        },
        "snapshot_note": {
          "type": "string",
          "description": "how the code snapshot was obtained/pinned for this case, when it matters for reproducibility"
        }
      }
    },

    "created_at": {
      "type": "string",
      "pattern": "^[0-9]{4}-[0-9]{2}-[0-9]{2}T[0-9]{2}:[0-9]{2}:[0-9]{2}(\\.[0-9]+)?(Z|[+-][0-9]{2}:[0-9]{2})$",
      "format": "date-time",
      "description": "the ingestion stamp (sprint constraint 5): when this case entered the store; add_case stamps it when the caller omits it"
    },

    "deployed_at": {
      "type": "string",
      "description": "when the underlying bug lived on-chain (or the advisory's publication date): OPERATOR-SUPPLIED provenance, NOT an ingestion stamp. Distinct from created_at, which add_case stamps at ingestion. May be ABSENT — the framework never defaults, invents, or overwrites it; absent means the honest provenance date is unknown. Free-string by design (the repo's backfill is uniform YYYY-MM-DD, but no date parser gates the schema: date semantics and ordering belong to the temporal rule that consumes this key, not to validation)."
    },

    "schema_version": {
      "const": 2,
      "description": "record shape version (sprint constraint 5): v2 = the dataset-ingestion sprint's evaluation-case shape"
    },

    "notes": {
      "type": "string",
      "maxLength": 1000,
      "description": "free-form adapter notes (dataset quirks, adjudication caveats)"
    }
  }
}
